{
  "version": "1",
  "generatedAt": "2026-01-01T00:00:00.000Z",
  "generator": "manual",
  "operations": [
    {
      "id": "listItems",
      "method": "GET",
      "path": "/api/items",
      "summary": "有出处的期望",
      "request": { "query": {}, "body": null },
      "response": { "fields": ["id"] },
      "sources": [{ "file": "src/pages/items/index.tsx", "lineStart": 3 }],
      "confidence": "medium"
    }
  ]
}
